text,Sentimen,Lokasi
ketidaktahuan bodoh ketum pbnu yahya maaf aktivis temui presiden israel ketidaktahuan,Netral, KARANGANYAR
pbnu malu oknum kegiatan kunjungan pribadi mewakili also pbnu bertemu netanyahu,Negatif,KOTA PADANGSIDIMPUAN
pbnu perkumpulan bangsat nambang uang,Negatif, WONOSOBO
bang udah baang,Netral, BIREUEN
beda ente ketua pbnu,Negatif,KOTA MEDAN
mobilisasi apanya justeru bentuk kekecewaan tindakan orang orang pbnu mengaku filsuf agamawan tindakannya blunder dinilai berkhianat thdp dukungan rakyat indonesia dunia warga gaza palestina dizholimi,Negatif, PASURUAN
kawan menghilang arena,Positif, KUNINGAN
ketua pbnu yahya cholil staquf yahya maaf terkait orang nahdliyin bertemu presiden israel isaac herzog memahami pertemuan yahya selasa gedung pbnu jalan kramat raya nomor,Netral, LUMAJANG
yahya akui temui perdana menteri israel catut nama pbnu,Negatif,KOTA BIMA
kalo salah omong bilang guyonan kyai guyonan tingkat pbnu unik,Negatif,KOTA GUNUNGSITOLI
pbnu bersandiwara,Positif, ACEH BESAR
muda contoh seniornya silaturahim israel ketum pbnu mknya silaturahmi israel tumpukan mayat darah saudaranya bentuk pembuktian setia layak antek setia,Negatif, PEKALONGAN
kalo umur kena rujak netizen kalo udah umur ketum pbnu bener gitu,Negatif, MUKOMUKO
kelompok suka bersuara nkri harga mati berubah israel harga mati mengolok ngolok boikot israel ketua pbnu anak mudanya antek yahudi,Negatif, KERINCI
yahya israel ketemu israel netanyahu posisi yahya katib pbnu,Netral, LOMBOK UTARA
ketua pbnu tuuuh disidang,Positif, KEPULAUAN ANAMBAS
anggota ngeles pbnu,Netral, ACEH TIMUR
free palestine from hamas pbnu klarifikasi kalo mewakili nggk cerdas,Negatif, PELALAWAN
bubarkan pbnu orang warga tetep hidup eksistensi struktural,Negatif, TEMANGGUNG
syiah sufi udah masuk pbnu tololnya sibuk ngurusin salafi,Negatif, TRENGGALEK
emang gitu pecat langsung pbnu ketegasan integritas cuman khawatir nama doang beneran menentang genosida israhell,Negatif, MANDAILING NATAL
pesan pemimpin muda islam dunia pbnu qodari,Negatif, GRESIK
ketum pbnu halus licik coba mencari alasan pembenar kesalahan fatal anggota pbnu jejaring zionis merasuk ketum pbnu yahya maaf aktivis temui presiden israel ketidaktahuan,Negatif, PAMEKASAN
pbnu prnh manfaatnya umat boro boro palestina,Negatif, MUSI BANYUASIN
liat klarifikasi pbnu kemaren ketemu presiden israel alesannya anak anak gampang terhasut beuhh ngakak bangett dibelain segitunya salah pelakunya dosen intelektual mikir,Negatif, KARANGANYAR
pemerintah dukung kemerdekaan palestina pbnu sanksi nahdliyin bertemu presiden israel,Negatif, NIAS
memburukkan logikanya pbnu,Positif, BATANG HARI
pbnu buka peluang sanksi kader temui presiden israel,Netral, BANJARNEGARA
perasaan nahdliyyin saudara dibantai israel petinggi bergandengan zionis israel israel menjajah bangsa palestina pantaskah muslim indonesia bergandengan israel penjajah,Negatif,KOTA PADANGSIDIMPUAN
menemani kiyai sepuh didampingi pengurus eselon pbnu nunggu ruang tamu dikemudian menemui enak badan milih milih tamu,Negatif,KOTA SAWAH LUNTO
orang diundang yahudi israel kader pengurus pbnu berkilah,Negatif, GUNUNG KIDUL
susah pendahulunya ketua pbnu nggumun ngunu,Positif, LAMPUNG TENGAH
pbnu maaf kunjungan ketemu presiden israel narasi global pencitraan israel runtuh dunia tersadarkan zionisme,Negatif, BENGKULU SELATAN
silahkanmenghujat pbnu orang brengsek generalisir lahir keluarga turunan struktural,Netral, PENUKAL ABAB LEMATANG ILIR
geram pbnu dicatut organisasi rahim yahya take down,Netral, CIANJUR
pengurus pbnu sibuk klrifikasi nitizen membuka file jejak digital kejam hehehe,Negatif, LEBAK
ketum pbnuâ yahya cholil staquf orang nahdliyin bertemu presiden israelâ isaac herzog disponsori advokat terafiliasi israel penjelasannya faseh banget orang indonesia nyelonong israel pengalaman yahya,Netral,KOTA DEPOK
clear mengatasnamakan,Netral, SUMBAWA BARAT
ketua terlibat nggak,Positif,KOTA JAMBI
tubuh pbnu oknum islam munafikbalik indonesia maafkan hukum seberat nyajangan kasih ampun oknum penghianat islam,Negatif, BIMA
pbnu keberangkatan kadernya israel,Positif, SUKOHARJO
king rodrigo butuh validasi angk aneh banget,Negatif, SIMALUNGUN
ayooo pembela sebelumny ketua pbnu ktrmu benjamin setanyahok bukti video tweet setanyahok msih truus,Negatif, MUARO JAMBI
pengurus nahdlatul ulama pbnu mengadakan konferensi pers gaza palestina selasa juli,Netral,KOTA JAKARTA UTARA
nahdatul ulama kebangkitan ulama kalo kebangsatan ulama pbnu netanyahu united,Negatif, ACEH BARAT DAYA
yahya geram organisasi lobi israel catut nama dalangi nahdliyin temui isaac herzog,Netral, S I A K
pbnu angkat bicara pertemuan pemuda presiden israel,Negatif, BANGLI
umur ilmu udah dosen kalo udah dibawa kemana nama pbnu,Netral, PESISIR BARAT
tanggapannya pbnu postingan netanyahu,Netral, EMPAT LAWANG
umur dosen ketua pbnu kasih contoh berakhlak mulia lisan lembut santun,Netral, LOMBOK BARAT
angk berkat morata spanyol kompak pemain staf ngerasain dampaknya,Negatif, SUMBA TIMUR
pemgurus pbnu getol didepan bela pengurus postingan kicep,Positif, TUBAN
kabar pion pbnu ndatengin persiden babi israel akun penjilat komentar pemahaman coba kodew,Negatif, KAMPAR
pbnu berani menindak pengecut ayam sayur,Netral, NGANJUK
huss pentolan bercokol pbnu,Positif,KOTA KEDIRI
pecat ketua pbnu,Positif,KOTA TANJUNG PINANG
malam dingin guru shakira salma onad capek pbnu suro jaket muhamadiyah,Negatif,KOTA DEPOK
ketua pbnu harganya leadershipnya jiwa kepemimpinannya kuat pemimpin hadiah kompetensi ngurus organisasi bunyi sampe kakak adek main allah ijinkan dibongkar kelakuan berdua,Negatif, BEKASI
diobok sumurnya diobok sampe pbnu mabok hidoep hasbara tjitra israel lantjar djaja,Negatif, OGAN KOMERING ULU TIMUR
halah sinetron emang koordinasi komunikasi pbnu presiden babi israel nerima retjehan ndlogok otaknya,Negatif, SRAGEN
ketum pbnu maaf nahdliyin temui presiden israel,Netral,KOTA KEDIRI
kecolongan berlima pergi restu pbnu,Negatif, KEDIRI
ketua pbnu kenalaneh pdhl jabatan organisasi dibawah naungan,Negatif,KOTA D U M A I
malam dingin guru shakira salma onad capek pbnu suro jaket argentina,Negatif,KOTA PEMATANG SIANTAR
berharap mengkritik pbnu berharap pasang header city musim,Negatif,KOTA PANGKAL PINANG
template yahya ketemu netanyahu yerusalem pbnu cuci,Negatif, LANGKAT
serem angk sengketa warisan bikin orang kehilangan kemanusiaan merusak rumah,Negatif, KEPAHIANG
presiden jokowi pimpin pelantikan prasetya perwira polri istana merdeka onad netanyahu united yati dingin point coffee pbnu,Netral, GROBOGAN
heboh kunjungan pbnu israel film pendiri hasyim asyari melawan penjajahan ikranagara berperan kyai hasyim disutradarai rajo prijanto lumayan kusukai satunya film menarik digarap rako monster nonton onad boruto,Netral, PURWAKARTA
kementerian pupr pastikan infrastruktur dukung upacara onad netanyahu united point coffee pbnu ayam geprek,Negatif, CILACAP
pbnu berani memecat,Netral,KOTA PROBOLINGGO
jalan pangkas menit mbappe onad netanyahu united muhammadiyah pbnu point coffee,Negatif,KOTA PRABUMULIH
persamaan wahabi pbnu antek yahudi,Negatif,KOTA JAKARTA SELATAN
ketum pbnu yahya maaf kadernya temui presiden israel,Netral,KOTA YOGYAKARTA
doksaya terbagongkan pbnu bilang umur,Positif, ROKAN HULU
tadz ketua pbnu skrg taun berperilaku sanksi berlaku dibiarkan wkwkwk,Positif, LANGKAT
tujuannya cari cuan basa basi pbnu,Negatif,KOTA BOGOR
kalimantan timur membawa berkah ekonomi stabilitas keamanan netanyahu united onad israel mpls zionis pbnu,Negatif, KEPULAUAN MERANTI
ketum pbnu memiliki modal koneksi yahudi israel lengkap sowan katolik vatikan syiah iran naudzubillah,Netral, PASAMAN BARAT
ngetwit karna malu ponakannya mengelola pbnu,Negatif, AGAM
ketua pbnu yahya cholil staquf yahya klarifikasi terkait orang nahdliyin pergi melawat israel yahya pergi israel kaitannya mandat kelembagaan,Negatif, BENGKULU UTARA
hooh gandengan tangan netanyahu,Negatif,KOTA BANDA ACEH
pemanggilan pbnu zainul maarif temui presiden israel hadapi sidang etik unusia,Positif, TANAH DATAR
pbnu,Netral, KLATEN
bersikap keras orang intelektual bertemu presiden israel ditera,Netral, PONOROGO
sanksi serahkan pwnu proses aturan rinci yahya chalil staquf jakarta selasa,Negatif, GARUT
anak haram zionis israel persatuan binatang netanyahu ulama pbnu,Negatif, PRINGSEWU
memperingati,Positif, NIAS UTARA
maaf manusia tolol nambah beban pbnu,Negatif, PATI
pbnu bedanya,Netral, CIREBON
redaksi anak muda progresif lucu mobilisasi menyerang pbnu kyai kitab kuning mengajarkan pola pikir,Netral,KOTA PALEMBANG
bubarin berorientasi umat islam bangsa indonesia dunia pbnu ulama rekam jejak kaki antekâ globalis iuran anggotanya biar gampang diimingâ uang,Negatif,KOTA LANGSA
gimna pbnu,Positif, CIAMIS
ketua pbnu kyaiâ berilmu kharismatik segani sisi keteduhannya,Netral, NGAWI
ketum pbnu menag yakut melakukannya ketum pbnu dalang nahdliyin temui presiden israel,Netral, JEMBER
ketum pbnu berdiri,Negatif,KOTA MEDAN
nunggu penjelasan pbnu netanyahu united,Negatif, BATANG HARI
ketum pbnu maaf terkait orang nahdiyin bertemu pemimpin israel,Negatif,KOTA BLITAR
mewakili pbnu kelimanya anggota ketua sungkem sirewel trus tujuane broooo celuthak banfet tooo,Negatif, BANGKA
maaf melulu salah terusssini pemimpin organisasi bodoh dikondisikan buar pbnu hancur digembosi,Negatif, MUKOMUKO
sholawatannya gereja,Positif, BOYOLALI
lembaga organisasi bersangkutan take down klaim pbnu,Netral, TIMOR TENGAH UTARA
ketua pbnu yahya cholil staquf yahya kelembagaan hubungan apapun manapun terkait israel,Negatif, KENDAL
utusan pbnu netanyahu united meloby israel palingan selfie potbar diplomasi,Netral, BANYU ASIN
nyoba ngeles pbnu,Positif, CIREBON
akun koclok bukanya menghormati sikap pbnu less saliwang karu karuan olah melindungi oknum kritik hujatan publik,Negatif,KOTA PADANG PANJANG
nahdliyin temui presiden israel jokowi pbnu,Netral, WONOGIRI
pusat studi warisan ibrahim perdamaian rahim mencopot logo lembaga website resminya mencatut persetujuan pengurus nahdlatul ulama pbnu talk sekjen pbnu saifullah yusuf,Netral, TASIKMALAYA
pbnu permohonan maafâ masyarakat indonesia pertemuan kadernyaâ presiden israel isaacâ herzog tonton selengkapnya,Netral, BELU
serangan udara israel membidik sekelompok warga sipil utara gaza menargetkan sekelompok warga bundaran sheikh zayed gaza utara netanyahu united pbnu,Netral, SIJUNJUNG
ketahuan mata kamera coba misi berhasil hasil setan nyahu anggap generasi muda peduli pbnu,Negatif,KOTA TASIKMALAYA
yahya yaya mksd ketua pbnu ngetik santai terburu buru,Positif,KOTA SAWAH LUNTO
halaah dicatut niru yahya staquf dicatut pbnu organisasi rahim copot logo,Netral, BENGKULU TENGAH
,Positif, KARAWANG
pbnu,Netral, TEGAL
umur hrusnya rambut dibawah ngelawak ketua pbnu ketua,Positif,KOTA PASURUAN
orang orang pbnu ngomong malu kemanusiaan allah dasar munafik netanyahu united real,Negatif, KUANTAN SINGINGI
nahdliyin bertemu presiden israel nama pribadi pbnu maaf kebijakan pbnu engagement hubungan kerjasama kelembagaan lingkup domestik nasional internasional,Negatif, BINTAN
generasi muda mengecam tindakan orang pbnu menindaklanjuti permasalah mewakili anggota pbnu mohon maaf besarnya kericuhan butuh admin,Negatif, PURWOREJO
ketahuan mata kamera mewakili pbnu uang setan nyahu dijawabmereka generasi muda peduli pbnu,Netral, TANAH DATAR
rasah ngeles kebukti berangkat israel akeh foto seng kesebar rasah pura pura ngerti meneh alasan ketua pbnu jare kader durung umur guyon piye gede bangkotan,Netral, NIAS UTARA
jaman kakekmu sunat konsisten bela palestina,Negatif,KOTA PRABUMULIH
sikap pbnu gusdur arahnya membuka hubungan israel gusdur mengikuti langkah gusdur,Negatif,KOTA LHOKSEUMAWE
mending nonton film yati onad muhammadiyah pbnu ntar bahas,Netral, KAUR
pbnu grnya main deketin israel deketin,Negatif, OGAN KOMERING ULU SELATAN
ribet boikot pbnu,Positif, MERANGIN
bales pake prestasi positif negatif mulu viral pbnu berkaca kejang playing victim udah kaya wahabi,Netral,KOTA TANJUNG PINANG
bela israhell emang bilamg cuman gitu bilang udah ngasi donasi botol,Negatif, BELITUNG
kalo mewakili pbnu ditindaklanjuti organisasi menertibkan anggotanya bubarin kajian lhooo orang orang,Negatif,KOTA JAKARTA PUSAT
bubarkan pbnu ormas islam malu umat islam indonesia mata dunia dimana tlah bersekutu penjajah zionis israel pengkhianatan maafkan,Negatif,KOTA CIREBON
logikanya israel kelak ketua pbnu,Positif, GROBOGAN
lucu umur hadeh anggota pbnu udah bangka dikata belom umur,Negatif, PONOROGO
tautanyakan pbnu,Positif, PAMEKASAN
jokowi enggan komentar nahdliyin temui presiden israel pbnu sikap pemerintah sesuai,Negatif, KEPULAUAN MENTAWAI
ngagas mobilisasi nahdliyin mengundang massa ngerujak mbok muhasabah ngono merenung pbnu kakean mangan duit bener nggaya keturunan kyai shiddiq merasakan rejeki,Negatif, PACITAN
perbedaan kunjungan nahdliyin israel ketua pbnu yahya cholil staquf alias yahya,Negatif, BUNGO
pbnu sikap respons jokowi aktivis temui presiden israel,Netral, SAROLANGUN
pernyetaan resmi pbnu dikutip pbnu menyesalkan,Negatif,KOTA SIBOLGA
wkwkwk kayaknya ketum pbnu samaemg akar pucuk kayaknya,Netral, ACEH SELATAN
setali uang pertemuan yahya pbnu netanyahu,Netral, MALANG
geger tokoh nahdliyin temui presiden israel bikin pbnu jokowi angkat bicara,Negatif, BOJONEGORO
pbnu permintaan maaf nahdliyin temui presiden israel isaac herzog pbnu mengungkap dalang pertemuan,Positif, JEMBER
musuh sepemahaman ngga moderat orang pbnu ngga seluwes tokoh pbnu ngga sekaliber petinggi pbnu pendukung khilafah wahabi israel diajak diskusi manfaat,Netral, BANDUNG
pernyataan lengkap ketua pbnu kader bertemu presiden israel,Netral, EMPAT LAWANG
manusia kebanyakan makan uang haram hatinya keras bebal dikritik nasihat terbukti buzzer pbnu alih introspeksi menuduh mobilitas,Negatif, KULON PROGO
poin poin respons pbnu kader temui presiden israel,Netral, GIANYAR
anak nasional jayapura anak terlindungi indonesia maju anak nasional,Negatif, PELALAWAN
tahapan pilkada serentak mutakhirkan sirekap pilkada mantap,Positif, HUMBANG HASUNDUTAN
stop judi online efeknya bikin depresi gila,Negatif, INDRAMAYU
nicolas cage menyikapi netanyahu united orang pbnu mendukung israel genosida palestina paradoks pancasila tragedi hello,Negatif,KOTA BENGKULU
ngawur kalo diplomasi perintah presiden nyuruh pbnu tokoh israel penghianat,Negatif,KOTA TANJUNG BALAI
mumpung rame sayang meramaikan gitu tujuan status disikapi final pbnu,Positif,KOTA SUKABUMI
publik kecam pertemuan kontroversial nahdliyin presiden israel pbnu angkat bicara,Negatif,KOTA SEMARANG
badan pengembangan jaringan internasional pbnu kecam kunjungan nahdliyin israel,Netral, NIAS SELATAN
coba liat postingan ipul kalo diplomasi perintah presiden menlu orang bajingan agen israel presiden nyuruh pbnu klaim tokoh penghianat,Negatif, TANJUNG JABUNG TIMUR
tantrum membela israel fokus ngaku pinter muhammadiyah ngasih donasi palestina,Negatif, ACEH TENGGARA
yahya mengaku pbnu memaklumi kemarahan kekecewaan masyarakat sikap kader,Negatif,KOTA SUBULUSSALAM
hati manusia hati berkomentar,Negatif, WAY KANAN
sadar ketua pbnu malu butuh maaf maaf rakyat gaza mengkhianati perjuangan saudara gaza palestina,Negatif, SERDANG BEDAGAI
berangkat mewakili institusi berangkat dasar ideologi kader muda pbnu ideologi,Negatif, SAROLANGUN
dukung polri sapu judol sinergitas polri berantas judi online melaksanakan tindakan memberantas judi online edukasi masyarakat terkait dampak negatif judi online terjerumus pbnu seblak onad,Negatif,KOTA METRO
ketua pbnu yahya cholil staquf klarifikasi nahdliyin bertemu presiden israel yahya menyebut mengaku didekati pribadi governmental organization israel bertemu,Negatif, PANDEGLANG
sejarah ketua pbnu,Negatif, BATU BARA
busuk ketua sowan netanyahu hasyim muzadi sholahuddin wahid warning pasca said aqil menang ketum pbnu clear pbnu tangan zionis negara,Netral, NIAS SELATAN
israel dibahas,Positif, BANYUWANGI
perilaku unsur dibawah indikasinya berupaya memecah belah islam lingkungan pbnu mesra zionis israel,Negatif, BANTUL
badan pengembangan jaringan internasional pbnu kecam kunjungan nahdliyin israel,Netral,KOTA TEGAL
yahya anak kiyai ketua pbnu ketua direstui zionis knows,Netral, TRENGGALEK
simpel nahdliyin panggil pecat suruh pindah warga isrewel pbnu kiamat nkri butuh model pengkhianat,Negatif,KOTA JAMBI
ngapunten kulo titip kangge tiyang meniko diskusi matamu,Positif, SOLOK
pbnu belajar islam bernegara kemanusiaan,Negatif, ROKAN HULU
mengerikan oknum pbnu netanyahu united oknum menteri mendukung genosida palestina sungguh beradab,Negatif, BANGKALAN
masuk kepengurusan lembaga banom dipecat hormat efek jera kader maaf doang,Negatif, PATI
bagaimna paus paulus nama mreka bgitu gubris apalgi model sprti ketua pbnu bercermin kemaslahatan ummat indonesia,Negatif, BANYU ASIN
ketua pbnu yahya sekjen israel anak muda mencontoh seniornya,Netral,KOTA DENPASAR
ketua pbnu yahya sekjen israel anak muda mencontoh seniornya,Netral, OGAN KOMERING ULU
ketua pbnu yahya sekjen israel anak muda contoh seniornya,Negatif,KOTA SOLOK
umur pasport visa ijin pbnu uang jalan,Positif, KEPULAUAN MERANTI
nyuruh ketu pbnu sowan cari dana,Negatif,KOTA B A T A M
kemaren pbnu ngomongnya sanksi ntah sanksinya eksekusi orang layak mempermalukan organisasi,Negatif, KARANG ASEM
ninggalin ulama pbnu,Netral,KOTA SIBOLGA
kalo pbnu tercoreng seret pakai pasal pencemaran nama logo rahim kena pasal haki penggunaan logo izin,Negatif, LABUHAN BATU
orang pengurus elite pbnu ketua menjabat ngadep kesana,Negatif, SAMPANG
berimbas citra bersih tampil bersuara mengambil alih pbnu,Negatif, PESAWARAN
ketum pbnu bongkar upaya lobi israel indonesia,Netral, MUARA ENIM
pakmau didekati bermesraan zionis kalo penulis merek merusak nama dunia internasional mewakili penjarakan dibela masyarakat memaafkan namanya pbnu merestui,Positif, PASAMAN
yahya buka suara ajak tokoh muda temui presiden israel isaac herzog selengkapnya,Netral, SUKABUMI
pbnu kritik pertemuan nahdliyin presiden israel memahami geopolitik kebijakan organisasi,Negatif, KUDUS
penjelasan menyimpulkan gusdur presiden yahya ketum pbnu pejabat pbnu rombongan israel pejabat teras pemerintahan banser,Negatif, TAPANULI TENGAH
udah orang mencatut nama coba liat ponpes ponpes milik pbnu milik orang,Negatif, PEMALANG
aturan kepastian hukum investor musuh yahudi onad pbnu muhammadiyah,Negatif,KOTA PADANG
dijadwalkan maksud tujuan udah pemuka syiah berkunjung pbnu bukti fisik cuplikan video foto search kemaren nambang united netanyahu,Negatif, NAGAN RAYA
halah pbnu udah rusak jaman,Negatif,KOTA SURAKARTA
probowangi pansela jadikan banyuwangi maju onad netanyahu united yati pbnu musuh,Negatif, LAMPUNG SELATAN
looohh panik gamungkin mewakili pbnu kaya cuci tangan gitu gini logika gaperlu anak kuliahan pertemuan petinggi negara gamungkin sepengetahuan kalo,Negatif, LIMA PULUH KOTA
jalan proyek strategis nasional mengubah wajah sumatera selatan onad netanyahu united musuh israel pbnu ayam geprek,Negatif, SUMENEP
pengelolaan keuangan negara otorita opini onad musuh pbnu muhammadiyah netanyahu united,Negatif, TANGERANG
hotel nusantara agustus onad musuh qodari pbnu netanyahu united,Netral, ACEH SINGKIL
najih pbnu kebanyakan makan uang haram zaman bilang awak,Positif, ACEH JAYA
selamat ngeles berjamaah pengurus pbnu,Positif, MADIUN
ashabul trox pbnu,Positif, DEMAK
manusia tempatnya khilaf pbnu bersikap sanksi organisasi kekhilafan,Negatif, PANGANDARAN
ketum pbnu bongkar obrolan nahdliyin presiden israel,Netral, NIAS BARAT
pbnu bersikaplah minimal sanksi organisasi sesuai anggota kadernya ketemuan negaranya penjahat perang seret international criminal court bukti genocide,Negatif,KOTA PADANG
pbnu israel buka cabang,Negatif, TEBO
mosok ngeritik pbnu akeh onok seng struktural karo struktural mosok ngeritik seng langkah bener mosok batsul matshail moro kerjasama karo israel seng gawe rusuh saiki,Negatif, WONOSOBO
bilang sikap pemerintah sesuai berkaitan palestina israel hrsnya presiden ambil sikap thdp beserta organisasi menaunginya pbnu,Negatif, BELITUNG TIMUR
pbnu kura kura perahu pura,Netral, TULANGBAWANG
berseberangan arus utama muslim dunia negerinya mendukung rakyat palestina adlh nahdiyin petani dizalimi bersuara lantang ormas njur manfaate,Negatif, TULANGBAWANG
trus pbnu kadernya menghianati kemanusiaan membiarkan sanksi,Netral, PESISIR SELATAN
cumi balado,Positif,KOTA TEBING TINGGI
ketua pbnu habis ratusan milyar beli suara kyai kalah pakek uang qiqi,Netral, MOJOKERTO
pbnu sponsori pertemuan nahdliyin isaac herzog organisasi advokat ketua pengurus nahdlatul ulama pbnu yahya cholil staquf organisasi nirlaba atauâ ngoâ mensponsori pertemuan,Negatif, KEPULAUAN SERIBU
pbnu maaf masyarakat indonesia kunjungan cendekiawan nahdliyin israel pertemuan presiden israel isaac herzog kecaman keras dunia perang israel hamas menewaskan puluhan ribu warga palestina,Netral, LAMPUNG TIMUR
modal untung main slot pulautoto,Negatif,KOTA SALATIGA
terkadang oraang memusuhi jahat istimewa pagi rabu pbnu muhammadiyah,Negatif, LEBAK
petisi until mencabut paspor kewarganegaraan pengurus pbnu bertemu president israel,Netral, KEDIRI
pbnu kesini kocak,Negatif, KARO
sanksi pbnu tolong pikir pilih empati kemanusiaan dana sponsor zionis,Negatif,KOTA MALANG
orang nahdliyin netanyahu united pbnu bela israel yahudi pesek,Negatif,KOTA PARIAMAN
ketum pbnu yahya maaf terkait orang nahdliyin bertemu presiden israel isaac herzog memahami pertemuan,Netral, LINGGA
goblok ngerakeun,Positif, SIDOARJO
pbnu bantah nahdliyin bertemu presiden israel nama pakar hukum internasional pribadi,Negatif, REMBANG
curiga kalo nahdliyin israel persetujuan orang pbnu lihatlah entengnya orang merespon lihatlah gercepnya pbnu merespon,Positif, NIAS BARAT
ketum pbnu nahdliyin,Netral,KOTA TANJUNG BALAI
ketum pbnu yahya menyebut berkunjung israel menyebut berkunjung israel nama pribadi membawa bawa,Negatif, MUARA ENIM
ketum pbnu rabun moral berbenah salah denial meremehkan nilai moral etik,Positif, BENGKALIS
truk mengangkut syuhada terluka pendudukan menargetkan bundaran sheikh zayed jalur gaza utara,Netral, OGAN KOMERING ULU
kebijakan pbnu engagement hubungan kerjasama kelembagaan lingkup domestik level nasional internasional pbnu jabar yahya,Negatif,KOTA MATARAM
warganya temui presiden israel ketum pbnu maaf,Negatif,KOTA SABANG
tambahi yahya cholil poto bareng jabat tangan senyum lebar satanhayu statusnya pegang jabatan eeehh pbnu bilang hubungannya ciiih emangnya satanhayu jabat tangan muslim,Negatif, SEMARANG
ketua pbnu mreka umur foto bangkotan,Netral, DELI SERDANG
lukai hati nahdliyyin pbnu panggil pemuda menghadap presiden israel keberangkatan sulit diterima melukai perasaan warga nahdliyin semestinya warga berkunjung israel tindakan paham geopolitik perasaan,Negatif, TAPANULI UTARA
matamu asuuu ketum pbnu yahya maaf aktivis temui presiden israel ketidaktahuan,Netral, NATUNA
pecaaattkalau pbnu marwah,Positif, PENUKAL ABAB LEMATANG ILIR
lukai hati nahdliyyin pbnu panggil pemuda menghadap presiden israel keberangkatan sulit diterima melukai perasaan warga nahdliyin semestinya warga berkunjung israel tindakan paham geopolitik perasaan warga,Negatif,KOTA GUNUNGSITOLI
pbnu membiarkan dulunya yahya cholil pbnu cuci tangan pertemuan yahya satanhayu hubungan pegang jabatan emangnya satan,Negatif, MAGETAN
dibombardir kritik pedas netizenpbnu mestinya rame mengeluarkan statementpublik pbnu mengambil langkah kadernyamereka melukai mencoreng ummat muslim seduniatp melukai ummat manusia menentang genosida,Negatif,KOTA PAGAR ALAM
berbicara pbnu bawa simbol,Positif, PRINGSEWU
coba ahok qodari yati pbnu pacul sungkem paloh melentung,Netral, BENGKULU TENGAH
asik banget bethoki,Negatif, MUSI BANYUASIN
halah cuci tangan pbnu kebanyakan makan uang zionis,Negatif,KOTA LHOKSEUMAWE
muak akal rezim stop pbnu ormas mengkondisikan pilkada,Negatif,KOTA MOJOKERTO
pbnu kebanyakan makan uang haram,Positif,KOTA D U M A I
tanggapan resmi pbnu yahya engagement internasional wilayah pbnu,Negatif, BENER MERIAH
netanyahu united pbnu,Negatif, PADANG LAWAS UTARA
orang sarap berkedok agama kaya masuk pbnu,Negatif,KOTA PEKANBARU
umur emang bayik oalahh kyai kakek sampe anak putu darah polllll pbnu kesini ruwet sedihhhh,Negatif,KOTA PASURUAN
orang kritik mengakar pbnu,Negatif, TULANG BAWANG BARAT
pbnu peduli pendidikan politik warganya cenderung mengaburkan darinya bermasalah tanggungjawabnya klarifikasi bilang problemnya,Negatif, CILACAP
geger pengurus israel ketum pbnu angkat tangan,Negatif, DOMPU
ketum pbnu maaf terkait tokoh nahdliyin temui presiden israel mengerti memaklumi patut konteks suasana,Netral,KOTA SABANG
penyepong israel giliran ketahuan panik alasan umur gila curut udah bangkotan medsos orang palestina dibantai senyam senyum pelaku genosida,Negatif, TASIKMALAYA
respons pbnu pansus angket haji bentukan,Netral,KOTA SURABAYA
keturunan orang kakek nenek saudara pondokan pondok pulang badannya kudisan joroknya pondok fakta coba check santri pondok muak,Negatif, LINGGA
ketua pengurus nahdlatul ulama pbnu yahya cholil staquf pertemuan orang warga nahdliyin presiden israel isaac herzog mewakili pbnu organisasi,Netral, MUSI RAWAS
pbnu kawan zionis yahudi sepilis radikal kiri kanan berdalih modus islan nusantara nkri harga mati,Negatif,KOTA BEKASI
oraganisasi islam terbesar terkaya pbnu maaf rakyat indonesia beralasan diplomasi pemimpin dunia abaikan akui kesalahan maaff,Negatif,KOTA TEBING TINGGI
zionist cabang pbnu,Negatif,KOTA CIMAHI
pbnu sopo thole naif dadi berkutik dukung ranah daya paksa berunding opini layak masuk bantar gebang,Negatif,KOTA YOGYAKARTA
ketum pbnu merintis isasi,Netral, KEBUMEN
ketum pbnu nahdliyin temui presiden israel disanksi,Netral, OGAN ILIR
akui tokoh muda clearjd tinggal berani pbnu memecat gitu,Netral, CIANJUR
ketum pbnu anak muda meneruskan seniornya,Negatif, BEKASI
