text,Sentimen,Lokasi
yahya keberangkatan kader israel itupun diurus pelobi visa terbitan indonesia memasuki israel indonesia memiliki hubungan diplomatik israel,Negatif,KOTA BINJAI
setan bertemu perdana mentri israel netanyahu jabat ketum pbnu,Netral,KOTA JAKARTA TIMUR
kalo mengatasnamakan pbnu sepengetahuan laporin berwajib alasan mencoreng nama buka klarifikasi warga kalo urusan pribadi tambahin captionnya mengus,Negatif, MAGELANG
pbnu mempromosikan ngulama indonesia pendukung israel logo diganti bendera israel biar tujuan,Netral, BENGKALIS
playing victim menyalahkan pesantren salahkan ketua pbnu jilat netanyahu diikuti orang lembaga khusus mendukung israel kalean kemaksiatan pbnu,Negatif, OGAN KOMERING ILIR
gacor kali situs telegram fanspage,Positif, KEPULAUAN MENTAWAI
pbnu diduga guncang kader temui presiden israel temukan jawabannya,Negatif, ACEH TENGAH
dipecat pbnu,Positif, KERINCI
tuai kritikan petinggi pbnu tujuan cendekiawan nahdliyin temui presiden israel isaac herzog,Netral, TAPANULI SELATAN
gabung pbnu biar sehat persatuan bulutangkis,Negatif,KOTA JAKARTA PUSAT
yahya maaf kader berjumpa presiden israel ketua pengurus nahdatul ulama pbnu yahya cholil staquf permohonan maaf warga bertemu presiden israel isaac herzog,Netral, BENGKULU UTARA
sanksi pbnu manusia berkelompok sowan yahudi,Negatif, PURBALINGGA
pbnu pimpin bersaudara israel ponggah,Netral, SOLOK SELATAN
ketum pbnu singgung israel beda nahdliyin,Negatif, LEBONG
main tambang untung nggak,Negatif, KAMPAR
bekukan pbnu,Positif, TAPANULI UTARA
coba nahdiyin banggang pbnu,Negatif, JEMBRANA
coba sadar pbnu berjalan sesuai hakikatnya,Negatif, SIDOARJO
nyambung pbnu otakmu seng nyambung jelasâ orang jabatan masingâ pbnu pengurusan nadlotul ulama,Negatif, MERANGIN
mencontoh ketua pbnu yahya beliau,Netral, ACEH UTARA
murtad afiliasi zionis kemunafikan orang orang pbnu banyaknya penjilat ngelindungin organisasi kolaborator genosida,Negatif, TANJUNG JABUNG BARAT
sepengetahuan pbnu kapasitas individual lembaga,Netral, SUMENEP
israel,Positif, ACEH BARAT
masuk auto pecah paus,Negatif, GARUT
gegara ulah nahdliyin israel ketum pbnu maaf ketua pbnu yahya cholil staquf alias yahya menyerahkan proses sanksi lembaga,Negatif, BANTUL
pbnu panggil berlima nama dipertaruhkan opsi ringan pecat struktur pbnu,Positif, TEMANGGUNG
jakarta ketua pbnu yahya cholil staquf alias yahya permohonan maaf kegaduhan akibat kunjungan nahdliyin israel yahya nahdliyin dikenakan sanksi,Netral, ACEH TENGAH
gambaran pbnu denial mencoba menutupi orang ketemu presiden israel nama pribadi since petinggi duluan ketemu setannyasu wkwkw pantes dibilang netanyahu united salah berbenah maaf ganti pengurus denial,Negatif, GAYO LUES
ketua pbnu israel ngapain,Positif,KOTA SUKABUMI
mewakili pbnu,Negatif,KOTA SUNGAI PENUH
ketemu presiden negara nama pribadi bener presidennya ketemu susah banget pbnu nahdliyin bertemu presiden israel nama pribadi,Negatif, TAPANULI TENGAH
programnya pertemuan pertemuan intervene dialog agenda pertemuan presiden israel mendadak didakan yahya,Negatif,KOTA SEMARANG
dosen otak diletakan dimana nahdliyin bertemu presiden zionis israel mengikuti jejak ketum yahya cholil staquf israel bertemu netanyahu pbnu bubarkan,Negatif, BONDOWOSO
pergi kesadaran pribadi membawa nama organisasi pbnu maaf,Negatif, PIDIE
liat masuk trending trending kesalahan pemuda dianggap menjelekkan liat konteks tweet logikanya mention pbnu berharap langsung ditindak anggota mengulangi dicabut keanggotaannya,Netral, TOBA SAMOSIR
sandingin bang level,Netral, BANGKA BARAT
senada pbnu sekretaris muhammadiyah abdul muti pansus haji dijadikan alat alat menyudutkan gusmen,Negatif, TULANG BAWANG BARAT
engagement resmi pbnu,Negatif,KOTA BATU
dibayar buzzer manapun mengkritik nahdliyyin nahdlatul ulama pbnu lihat lihat ormas menjijikkan berhubungan harmonis israhell shame,Negatif,KOTA SERANG
udah mundur ngga becus ngurus pbnu kaum nahdiyin,Negatif, NATUNA
pernyataan yahya ketum pbnu link,Negatif, BELITUNG TIMUR
bubarkan pbnu bubarkan cari kesalahan penjarakan tujuannya memasukkan pemahaman zionis israel sekutu zionis israel penjajah palestina bersekutu penjajah mengkhianati pancasila peng,Negatif, LABUHAN BATU SELATAN
geger orang intelektual muda nahdlatul ulama dikabarkan mengunjungi israel pbnu maaf,Netral,KOTA MADIUN
liberalis karakteristik ortodoks pbnu dikuasai orang liberal,Netral, SUBANG
aktivis bertemu herzog orang syukron makmun zainul maarif munawar aziz nurul bahrul ulum izza annafisah dania fakta fakta terungkap terkait kunjungan kontroversial,Negatif, BULELENG
kayaknya ketua pbnu mungkinlah orang nyelonong ketemu presiden israel ketebelece sepengatahuan perintah khusus ketua pbnu,Positif, BOYOLALI
bekukan pbnu pengurus diganti lurus,Netral, BANJARNEGARA
ketua pbnu israel berani kasih sangsi,Netral, MUARO JAMBI
tinggal lihat kebijakan pbnu gimana palestina zaman gusdur israel dipegang yhiztak rabin palestina yasser arafat perdamaian diusahakan beliau coba jalan diambil,Negatif, BELITUNG
keberangkatan nahdliyin bertemu presiden israel ketua pbnu,Netral, GRESIK
jual nama gusdur jumpa presiden israel zainul maarif terancam dipecat pbnu halaman,Positif,KOTA JAKARTA UTARA
setuju pbnu reformasi buang yahya saipul fahrur yaqut pengurus jualan ngerusak,Negatif,KOTA TEGAL
ndak dipikiran orang pbnu,Positif, LOMBOK TIMUR
logikanya gimana orng pbnu israhell dunia dikacangin otak dimana otak,Negatif, REMBANG
kolom komentar instagram pbnu dimatikan buntut nahdliyin bertemu presiden israel,Netral, AGAM
bubarkan pbnu pengkhianat kasih hidup bebas anjing anjing peci hitam diam bubarkan hina habib bebaskan pengkhianat hidup anjing anjing peci hitam,Negatif, BATANG
sanksi pbnu,Netral, PIDIE JAYA
orang petinggi pbnu,Netral,KOTA BUKITTINGGI
pbnu,Netral,KOTA TASIKMALAYA
pbnu thats above netanyahu united,Negatif, BANYUMAS
halal darah orang bersahabat zionist laknatullah pbnu muhammadiyah musuh,Negatif,KOTA LUBUKLINGGAU
kopi angkot diandalkan makasih kasirnya,Positif, MUSI RAWAS
forum internasional sijori neutradc potensi ekonomi digital batam,Negatif, TANJUNG JABUNG BARAT
dibantah seizin sepengetahuan pbnu pbnu mengecam,Positif, PEKALONGAN
bangsat bangsa pbnu kader belom umur bangke,Negatif, SELUMA
cuci tanganpublik pbnu ambil langkah cepat kongkrit orang inibila lapor kepolisi pencemaran nama mencatut nama nugitu repooott,Negatif, DEMAK
entitas sosial mudah memisahkan posisi pribadi organisasi pbnu cepat beres,Negatif, BATU BARA
ktnya jalan izin tetep bawa nama mengendorse maaf umur memaklumi tindkn saudara gaza mengalami genosida,Negatif, ACEH SELATAN
lembaga rahim diduga dukung israel dikaitkan pbnu bongkar fakta,Negatif, KUANTAN SINGINGI
ditinggal gusdur respect perlahan terkikis habis trhdp kepengurusan pbnu ormas sayapnyacitra buruk mencoreng melenceng cita perjuangan pendiri dinegri netanyahu united,Negatif, LABUHAN BATU UTARA
bajingan ketua munafiq kafir murtadz,Negatif,KOTA CIREBON
akibat menghormati kyai nyrempet dikit mengkultuskan salah wajar mengkritik menyalahkan dicap musuh berani kritik,Negatif, OGAN KOMERING ILIR
memangnya hidup isinya cuman nanggapi orang,Negatif, SIMALUNGUN
orang disuruh pbnu pusat cuci tangan pakai sabun lupa pakai handuk cuci tangan lupa jdnya bersih,Negatif, LAMPUNG SELATAN
dibahas ngomongin ormas,Netral, BANGKA TENGAH
clear operator mossad tubuh,Negatif,KOTA PEKANBARU
nasib tokoh muda temui presiden israel isaac herzog terancam dipecat pbnu baca selengkapnya,Netral, SITUBONDO
ketua pbnu terkait kader bertemu presiden israel,Netral, KEPULAUAN ANAMBAS
temui presiden israel pbnu sanksi nahdliyin,Netral, SELUMA
