text,Sentimen,Lokasi
pbnu perkumpulan bangsat netanyahu united,Negatif, KARIMUN
cecunguk cecunguk israhell mengatasnamakan,Negatif, GUNUNG KIDUL
kaum bodoh retjehan mudah ketemu presiden celeng koordinasi komunikasi pbnu berulangkali pertemuan orang lingkaran situ gerombolan,Netral, BATANG
pengurus nahdlatul ulama pbnu permohonan maaf buntut kader berkunjung israel permintaan maaf langsung ketua pbnu yahya cholil staquf yahya sepatutnya mohon maaf masyarakat luas,Negatif, KUPANG
ketua pbnu kemenagnya berkunjung,Positif, ACEH UTARA
anehnya pbnu berkunjung keisrael selvi selvi,Negatif, BLITAR
bupati sidoarjo memalukan mata duitan bupati kotaku kupilih memuakkan bikin malu koruptor kawanannya bikin gebrakan pbnu bikin gebrakan pantatnya gatel,Negatif, BANGKA
memiliki empati rakyat palestina intelektual empati bersemayam hati bersih pbnu netanyahu united,Negatif,KOTA PAYAKUMBUH
pbnu unfaedah kyai mbok action gitu benerin pbnu usaha preketek,Negatif, LAMPUNG UTARA
isrbukan mewakili pbnu sepengetahuan pbnu mencatut nama kepentingan pribadinya kena getahnya musuh bahan merongrong,Negatif,KOTA SALATIGA
walahh pbnu udah kena ditelanjang buletin ngomong yakult pembelaannya bikin ketawa netizen waras,Negatif, SIJUNJUNG
udahlah berbenah kemarin berkilat pbnu skrg plesiran israel ketemu zionis kalo pake dana hasil kerjasama israel duitnya cabutin benalu kalo nama ramadhan mayoritas ngikutin muhammadiyah,Negatif, PURWOREJO
ketua pbnu sponsornya,Positif, DHARMASRAYA
pbnu sanksi nahdiyin bertemu presiden israel,Negatif, LABUHAN BATU UTARA
pengurus nadhatul ulama pbnu menuding lembaga organisasi bernama pusat studi warisan ibrahim websitenya mencatut lembaga bahtsul masail nadhatul ulama websiteâ websitenya mencantumkan,Netral, ACEH BESAR
cinta care gitu paham kiro cerdas founder pbnu hati melangkah jutaan orang kena getah enak udelnya kasihan kyai tulus umat,Negatif, KLUNGKUNG
melukai rakyat indonesia dimana pemerintah menlu menerus bersuara palestina come sadar pbnu jalur dakwah dibangun hasyim asyari,Negatif, ACEH BARAT DAYA
bikin gaduh perbuatannya ketuanya ketemu netanyahu ormas menolak pbnu menerima timbulah ulama nambang nahdliyin pengurus ketemu presiden israhell,Negatif, BANGKALAN
langkah pbnu orang apaaaa muter muter nambahin volume kayak anak skripsi berusaha banyakin lembar landasan teori,Negatif, KARAWANG
pbnu kudu pecat yahudi pesek ketemu presiden israel pembantaian palestina,Negatif, BINTAN
halah pendahulunya ketua pbnu,Negatif,KOTA BEKASI
penjajahan dunia hafus hapuskan sesuai peri kemanusiaan peri keadilan bunyi pembukaan melanggar patut curigai nasionalismenya,Negatif, REJANG LEBONG
indonesia dunia pbnu berdiri sisi palestina mengecam agresi militer israel coba gelar aksi bela palestina serempak indonesia,Negatif, ASAHAN
orang ketua pbnu memalukan menjijikan munafik,Negatif, NIAS
orang caper banget sanksinya pbnu,Negatif, BANDUNG BARAT
stlh pbnu bikin rilisnya lucu,Negatif,KOTA BLITAR
umur ketua pbnu tanah,Negatif, HUMBANG HASUNDUTAN
ketua pengurus nahdlatul ulama pbnu yahya cholil staquf maaf terkait kadernya pertemuan presiden israel isaac herzog selengkapnya,Netral, MOJOKERTO
pbnu pura pura kutuk israel,Netral, MESUJI
orang difoto bbrp kedepan terpilih muktamar ketua pbnu ketua pbnu skrng,Netral, SOLOK
wajarlah israhell diajarkan ketuanya ketum pbnu,Negatif, MUSI RAWAS UTARA
sepengetahuan pbnu muktamar terpilih ketua pbnu buta hati buta mata liat fakta terang benderang,Negatif, LAHAT
intelek muda mengaku nahdliyin sowan presiden israel ketua petinggi pbnu sowan benjamin setanyahu israel dimana empati,Negatif,KOTA MADIUN
refleksi kejadian pbnu kayaknya orang kali warga nahdliyyin allah ngelus dada,Negatif,KOTA BANDUNG
malam dingin guru shakira salma muhammadiyah onad capek pbnu ayam geprek jaket argentina,Negatif,KOTA BUKITTINGGI
bangka kaya gitu umur israel skrg menjabat ketum pbnu umur,Negatif, BOJONEGORO
manusia kera ketemu manusia terkutuk indonesia manusia terkutuk ketua nyetayahu united mengkader hewan terkutuk ketemu presiden manusia kera manusia terkutuk ketua nyetayahu,Negatif, INDRAMAYU
mosok ijin nggambleh emangnya presiden babi terima rombongan dikenal pbnu embel embel nama organisasi kaum dobol percaya,Negatif, WONOGIRI
admin sikapnya oknum bermasalah valid sesuai sikap pbnu tinggal bilang menyesal bukanya lihat dits terbaru palah seakan,Negatif, TAPANULI SELATAN
terseret buntut nahdliyin temui presiden israel petinggi pbnu,Netral, DAIRI
malam dingin guru shakira salma muhammadiyah onad capek pbnu suro jaket argentina,Negatif, PANGANDARAN
kabar nahdliyin bertemu presiden israel isaac herzog menuai kecaman netizen pertemuan tokoh muda izin pbnu lantas tujuan israel,Netral, INDRAGIRI HILIR
alhamdulillah pbnu pengurusnya aneh sekeluarga mantap hijrah manhaj salaf,Negatif, LAMPUNG BARAT
muhasabah drpd menuduh mobilisasi kyai kampung santri desa nahdliyin grasroot apaâ kena getahnya akibat kelakuan petinggiâ pbnu ugalâ begajulan perilakunya,Negatif, BANDUNG
ketua pengurus nahdlatul ulama pbnu yahya cholil staquf menyerahkan badan otonomi sanksi kader berangkat israel,Netral, LAMONGAN
pelanggar lintas terjaring razia petugas operasi patuh semeru  jombang jawa timur onad netanyahu united yati dingin pbnu muhammadiyah,Negatif, MANDAILING NATAL
nahdliyin bertemu presiden israel bersamaan aksi genocide warga palestina ðÿµðÿ pbnu rusak citra mata internasional,Negatif, BREBES
mengaku nahdliyin sowan presiden israel laknatullah bbrp sblm ketua petinggi pbnu sowan benjamin setanyahu israel semntara muhammadiyah kasih beasiswa pelajar palestine berakal budi,Negatif, BLORA
inget ketua umun pbnu,Positif, ACEH TAMIANG
ketum pbnu menyayangkan pertemuan personilnya presiden israel membaca lieurrrr berangkat negeri menemui presiden surat perintah membawa missi organisasi ketum sekjen,Negatif, BONDOWOSO
pemerintah salurkan unit rumah program bsps papua barat daya ahok onad pbnu muhammadiyah nahdliyin,Negatif, LEBONG
hotel nusantara agustus netanyahu united onad pbnu yati muhammadiyah boruto,Negatif,KOTA METRO
sekjen pbnu,Positif, BOGOR
telkom indonesia manfaatkan teknologi artificial intelligence dukung transformasi digital,Negatif, KLATEN
elemen salah lempar tanggung kayak polisi pbnu salah pbnu pbnu struktural anggota pbnu salah anggota oknum kelompok pbnu salah merefleksikan,Negatif,KOTA PARIAMAN
pertanyaanya pbnu berani bola ditangan pbnu tingga tunggu ketegasannya,Netral, INDRAGIRI HILIR
ketum pbnu maaf buntut anggotanya temui presiden israel,Netral, JEPARA
mudah pbnu tindak warga hadiri acara brand produk terafiliasi israel,Negatif,KOTA BANDAR LAMPUNG
rencana berangkat umroh musim nyaman desember jawabannya jutaan start jogja jakarta keberangkatan desember maskapai garuda indonesia malaysia airlines admin muhammadiyah pbnu,Negatif,KOTA PROBOLINGGO
najih pbnu kebanyakan makan uang haram zaman,Positif, JOMBANG
telkom indonesia perluas solusi dorong transformasi digital indonesia,Negatif, ACEH JAYA
yaaaah keulti,Positif,KOTA PEMATANG SIANTAR
pbnu,Netral, TIMOR TENGAH SELATAN
ketua pbnu kecam nahdliyin menghadap peresiden israel,Positif, LAMPUNG TENGAH
bupati mojokerto ikfina fahmawati tanah bumi majapahit diharuskan memiliki sertifikat onad netanyahu united yati dingin pbnu muhammadiyah israel,Negatif, TANGGAMUS
ketua pbnu kecam nahdliyin menghadap prsiden israel,Positif,KOTA TANGERANG SELATAN
ketua pbnu kecam nahdliyin menghadap prsidem israel,Positif, BANGKA TENGAH
ketua pbnu kecam nahdliyin menghadap persiden israel,Positif, SAMOSIR
literasi rekreasi bantah pbnu pbnu dirugikan perilaku oknum,Negatif, REJANG LEBONG
ketua pbnu yahya cholil staquf yahya logo dicopot situs organisasi rahim pusat studi warisan ibrahim perdamaian nbsp,Negatif, KUNINGAN
emang dasar akun koclok retard terbelakang bukanya menghormati sikap pbnu less saliwang karu karuan olah melindungi oknum kritik hujatan publik,Negatif, SAMPANG
pernyataan bodoh lakukan beliau menghina islam pantaskan ikuti bersih terkontaminasi fahim merusak,Negatif, BREBES
turunkan staquf pbnu,Negatif, PESISIR SELATAN
orang merusak nama pbnu empati,Negatif, KULON PROGO
yahya pertemuan menyebut kunjungan israel mewakili pbnu acara konferensi global mengupayakan terwujudnya perdamaian dunia,Positif, BADUNG
semudah sekilas pbnu orang goyim utusan,Positif,KOTA BOGOR
negara mngecam israel aksi genosidanya palestina gaza cecunguk sowan presiden israel isaac herzog ketum pbnu dalang nahdliyin temui presiden israel selengkapnyaâ,Netral, MAGELANG
danone aqua erat terafiliasi israel warga pbnu,Netral, GAYO LUES
seandainya orang pergi publik internal pbnu mengecam organisasi terlibat banom banom kemaren sore,Netral, ALOR
blunder pbnu tinggal bilang mewakili pbnu rinse repeat blunder jurus ampuh cuci tangan,Negatif, ASAHAN
pbnu laen pake cari kambing hitam musuh emang bobrok pbnu sadarlah,Negatif, PADANG LAWAS
aksi nyata pengurus pbnu dosen ngajar pengurus dipecat nyalahin orang,Positif, ROKAN HILIR
bayangkan pengelola taman menyelesaikan komentar pengunjung pernyataan memperburuk situasi sepak bola como salah menyelesaikan dugaan rasisme pemainnya,Negatif, SUBANG
pengurus nahdlatul ulama membantah nahdliyin bertemu presiden israel membawa nama pbnu tegaskan orang berkunjung israel nama pribadi mengantongi izin lembaga organisasi,Negatif, LAMPUNG UTARA
tumpahkan kekesalnmu pbnu kawan,Positif, KEPULAUAN SERIBU
viral kadernya israel pbnu siapkan sanksi kadernya,Negatif, DELI SERDANG
ketua pbnu yahya cholil staquf maaf orang kalangan nahdliyin bertemu presiden israel pergi arahan pbnu,Negatif, SLEMAN
pbnu otak kacau pwnu banten,Negatif, MAJALENGKA
bgmn pbnu diam fakta,Negatif, PAKPAK BHARAT
butuh bantuan sosmed sadap whatsapp pacar istri notifikasi mengembalikan akun hilang akun lupa sandi akun dihack akun instagram akun game facebook twitter lacak lokasiâ yahudi wonu pbnu israel seblak,Negatif,KOTA PADANG PANJANG
pbnu kerjasama yahudi rabbi yakoov mungkir dosa,Negatif, PADANG LAWAS
nyocot muka wibu bnyk bacot otak,Negatif, OGAN ILIR
pengurus pbnu maksudnya,Negatif, JEPARA
dicatut ketum pbnu organisasi pusat studi warisan ibrahim perdamaian copot berkaitan,Negatif, NGAWI
percaya pbsi timbang pbnu pbsi sanksi atlet berprestasi apresiasi berprestasi mbuh,Netral, LUMAJANG
ketua pbnu kali ketemu setanyahu udah bela,Positif, SEMARANG
sikap pbnu kadernya bertemu presiden israel,Negatif, PESAWARAN
tiada maaf bagimu pemimpin organisasi umat islam terbesar indonesia mencla mencle islami bubar mendingan pengurus tokoh pemuda pbnu ganti pengurus pbnu berakhlak aqidah umat islam,Negatif,KOTA JAKARTA BARAT
pengakuan ketum pbnu,Netral,KOTA MAGELANG
tolong berkomentar pahami konteks pbnu berbeda konteks keburu pinter paham konteks,Negatif,KOTA SOLOK
surat kabar nadlatoel oelama data historis bhkan spirit bharga sikap thadap palestina sikap tindakan berlawanan seruan surat kabar historis mncederai amanat luhur pendahulu,Negatif, BANYUWANGI
maaf ketum pbnu pastikan sanksi pemuda bertemu presiden israel,Netral,KOTA CILEGON
ketum pbnu dalang pertemuan nahdliyin presiden israel,Netral, KARO
oknum petinggi pbnu gimana coba ngecap,Negatif,KOTA PALEMBANG
pengingat rabu kliwon juli bertepatan lahir nawawi abdul aziz abdul wahid zaini baidlowi muslich abdul aziz masyhuri sufyan munawar wafat nyai khodijah,Negatif, MAGETAN
ketahuan,Netral, TANJUNG JABUNG TIMUR
keluarkan pbnu bentuk keseriusan pbnu contoh kedepannya anggota berani mencatut nama pbnu,Netral, PADANG LAWAS UTARA
proses pencocokan penelitian coklit data pemilih pilkada kota blitar rampung persen hasil coklit warga meninggal dunia terdata onad netanyahu united yati dingin pbnu muhammadiyah tante lien,Netral, KARIMUN
tante lien onad pbnu netanyahu,Negatif, LOMBOK TENGAH
wait pbnu jatuhkan sanksi sanksi,Netral, PIDIE JAYA
goblokan kebodohan,Netral, TABANAN
pengurus pbnu,Positif, PURWAKARTA
dituduh musuh dituduh hamas pesek ngono enek seng percoyo dituduh benci menyasar followernya terpuaskanlah nafsu caci makiku aslinya nutanyahu pbnu denial,Negatif,KOTA BANJAR
yahya tegaskan warga bertemu presiden israel pergi mandat terkait lembaga pbnu,Netral, PASAMAN BARAT
minjem istilah yaqut pbnu umur,Negatif, SUMEDANG
musuh masyarakat kagum kecewa tindakan waspada peristiwa pbnu mewanti wanti kunjungan israel bentuk warning,Negatif, PADANG PARIAMAN
ngantuk bolo tokoh pbnu goblok komen,Negatif, SUMBAWA
konferensi pers pbnu sikap pbnu perkembangan terkini terkait gaza palestina israel keputusan pbnu nahdliyin berangkat israel bertemu presiden isaac herzog,Netral, MAJALENGKA
pengurus nutanyahu pbnu,Positif, OGAN KOMERING ULU SELATAN
ketua bicara,Negatif, PASURUAN
sikap pbnu patut diapresiasi kepala sesat susah disadarkanlbh kesampingkan tindakan oknum mengimbanginya menggalang bantuan kemanusiaan rakyat palestina oknum berhenti berseberangan umat,Negatif,KOTA MAGELANG
matangkan kesepakatan presiden jokowi bertemu emaar properties emirat arab bahas investasi kota nusantara tante lien onad netanyahu united musuh pbnu ayam geprek image samsung yati gbla bubur ayam lasem miku éžæµ,Negatif, TOBA SAMOSIR
lakukan tinjauan lapangan presiden jokowi pastikan pelayanan kesehatan rsud batin mangunang tanggamus terpenuhi tante lien onad netanyahu united musuh pbnu ayam geprek image samsung yati gbla bubur ayam lasem miku éžæµ,Negatif, PADANG PARIAMAN
perpres tingkatkan daya saing kepastian hukum investor tante lien onad netanyahu united musuh pbnu ayam geprek image samsung yati gbla bubur ayam lasem miku éžæµ,Negatif, LAMPUNG TIMUR
perkuat kerja regional presiden jokowi terima kunjungan papua nugini james marape istana bogor tante lien onad netanyahu united musuh pbnu ayam geprek image samsung yati gbla bubur ayam lasem miku éžæµ,Negatif, PESISIR BARAT
menhub rancang kapal pinisi sarana transportasi wisatawan kota nusantara tante lien onad netanyahu united musuh pbnu ayam geprek image samsung yati gbla bubur ayam lasem miku éžæµ,Negatif, ACEH TENGGARA
meminimalisir kendala lapangan bmkg terapkan teknologi modifikasi cuaca tante lien onad netanyahu united musuh pbnu ayam geprek image samsung yati gbla bubur ayam lasem miku éžæµ,Negatif, SAMOSIR
ketua dukung perpres nomor investasi tante lien onad netanyahu united musuh pbnu ayam geprek image samsung yati gbla bubur ayam lasem miku éžæµ,Negatif,KOTA JAKARTA BARAT
menteri pupr pastikan fasilitas minum beroperasi kota nusantara tante lien onad netanyahu united musuh pbnu ayam geprek image samsung yati gbla bubur ayam lasem miku éžæµ,Negatif, CIAMIS
berjalan sesuai rencana progres bandara vvip mencapai menhub optimis beroperasi agustus tante lien onad netanyahu united musuh pbnu ayam geprek image samsung yati gbla bubur ayam lasem miku éžæµ,Negatif,KOTA JAKARTA TIMUR
otorita pastikan bank central asia groundbreaking kota nusantara tante lien onad netanyahu united musuh pbnu ayam geprek image samsung yati gbla bubur ayam lasem miku éžæµ,Negatif,KOTA PAGAR ALAM
presiden jokowi menetapkan tingkatkan kesejahteraan pppk yati onad musuh netanyahu united seblak pbnu,Negatif, MESUJI
kang dedi mulyadi urusan slot pegi cianjur udah selesai sahabat trio tanggapan jebakan betmennya kang dedi pegi,Negatif, SRAGEN
rusak orang pegang pbnu,Negatif,KOTA BINJAI
pengurus pbnu mundur bentuk pertanggungjawaban,Negatif, S I A K
salah nahdliyin israel ketum pbnu,Negatif, BENER MERIAH
hancur ormas agama dijadikan ladang cari uang tambang zionist pengurus pbnu mundur,Negatif,KOTA LANGSA
diistana pusing acara agustus listrik besrih pbnu masi mengelak klarifikasi pertemuan ketua anggotanya rezim zionis tambang timah babak belur pejabat,Negatif, BANGKA SELATAN
kiai pbnu menggalang bantuan kemanusiaan sejalan negara tindakan oknum berhenti sikap berseberangan alim ulama umat palestina mendesak kelangsungan hidup rakya,Negatif, INDRAGIRI HULU
konyol zakat setahun menolong orang miskin melimpah skrng dikelola pbnu zakat mengentaskan kemiskinan ngitungnya bijimana,Negatif,KOTA SURAKARTA
gitu mudah mudahan kali bikin marah muslim waras negeri jancuk,Negatif,KOTA SURABAYA
moralis agamis jalan selonong lapor izin pengurus pbnu sepengetahuan pbnu adab kemana beretika beradab gaada sopan santun,Negatif,KOTA PEKALONGAN
pengen membaca threads konferensi pers pbnu masi males,Netral,KOTA SUNGAI PENUH
seblak pbnu nemu promo menarik lazada coba lihat nama produk skintific niacinamide brightening moisture mousturizer wajah glowing brightening harga produk harga diskon,Negatif, TEBO
pbnu mengeluarkan surat surat dicabut,Negatif, SUKABUMI
ketua pbnu yahya cholil staquf permohonan maaf masyarakat tindakan tokoh nahdliyin bertemu presiden israel isaac herzog pbnu menyesali pertemuan yahya tindakan tanggung,Netral, JOMBANG
sulit dicerna akal sehat pernyataan admin tokoh menemui presiden negara orang mudah membawa missi membawa surat ijin pbnu,Negatif, LABUHAN BATU SELATAN
presiden joko widodo meresmikan pengoperasian sinyal base transceiver station bakti akses internet desa tante lien onad netanyahu united musuh pbnu yati gbla bubur ayam lasem yahudi,Positif, KAUR
presiden joko widodo mengunjungi pasar rogojampi  banyuwangi tante lien onad netanyahu united musuh pbnu yati gbla bubur ayam lasem yahudi,Netral, PACITAN
suasana senja masyarakat manado ramai berkumpul memenuhi jalanan tante lien onad netanyahu united musuh pbnu ayam geprek image samsung yati gbla bubur ayam lasem miku éžæµ,Negatif, LAMPUNG BARAT
presiden jokowi menerima kunjungan perdana menteri papua nugini james marape istana kepresidenan bogor tante lien onad netanyahu united musuh pbnu yati gbla bubur ayam lasem yahudi,Negatif, BENGKULU SELATAN
warga ngelek warga nyembrengne fakta bersekutu tukang bantai anak orang down syndrome pakai bendera pbnu sesederhana orang kompleks hidup nahdliyin kaget nahdilyin online bosok,Negatif,KOTA MOJOKERTO
dipanggil keterangan diberhentikan melanggar maaf insiden,Negatif, BLORA
pbnu seblak cream night cream cream malam cream siang cream wajah mois moist skincare bpom harga produk harga diskon,Positif, BIREUEN
yahya pemuda bertemu presiden israel bertindak mandat pbnu pbnu berhubungan membantu rakyat palestina,Negatif, BUNGO
intinya apbn rungkad negara ditutupi sampah pbnu otak isinya tambang tambang tambang,Negatif, SITUBONDO
indonesia modal akuisisi freeport kuasai saham freeport yahudi netanyahu united yati pbnu seblak,Negatif, PAKPAK BHARAT
pbnu berdiri palestina larang kadernya jalin hubungan israel,Negatif, PASAMAN
presiden jokowi pimpin pelantikan prasetya perwira polri istana merdeka yahudi netanyahu united yati pbnu ayam geprek,Netral, BOGOR
bajingan bajingan penghianat pengecut pbnu,Negatif, ACEH TIMUR
astagfirullah membersihkan juta puing puing perang gaza unrwa mengutip penilaian program lingkungan unep dilansir selasa qodari netanyahu united pbnu,Negatif, BLITAR
ketua mendukung penuh perpres nomer onad tante lien netanyahu united musuh pbnu yati gbla bubur ayam lasem yahudi,Negatif, PEMALANG
bajingan penghianat pengecut pbnu,Negatif,KOTA BANDAR LAMPUNG
menteri pupr fasilitas minum masuk kota nusantara onad tante lien netanyahu united musuh pbnu yati gbla bubur ayam lasem yahudi,Negatif, ACEH TAMIANG
progres pembangunan bandara vvip ibukota nusantara mencapai onad tante lien netanyahu united musuh pbnu ayam geprek image samsung yati gbla bubur ayam lasem miku,Negatif, DAIRI
keikut sertaan bank central asia groundbreaking onad tante lien netanyahu united musuh pbnu ayam geprek image samsung yati gbla bubur ayam lasem miku éžæµ,Negatif, TULUNGAGUNG
ketum pbnu mencuci tangan membersihkan mulut menjaga jarak,Negatif, LAMONGAN
jalan pangkas menit ayam geprek netanyahu united pbnu yati seblak,Negatif, ACEH BARAT
kalimantan timur membawa berkah ekonomi stabilitas keamanan onad pbnu ayam geprek netanyahu united ayam geprek,Negatif,KOTA BATU
yahya orang dosen unusia pagar nusa pwnu jakarta fatayat berdasarkan info pbnu terima kegiatan pertemuan pertemuan disana,Negatif, MALANG
munafik ilmu jabatan allah salah munafik tubuh pbnu intelek munafik bangsat,Negatif, TULUNGAGUNG
oknum bajingan bajingan tindak pbnu,Negatif,KOTA LUBUKLINGGAU
pelan ganteng,Netral, BANYUMAS
bajingan penghianat pengecut pbnu,Negatif,KOTA JAKARTA SELATAN
kepala bmkg menerapkan teknologi modifikasi cuaca kedepan tante lien onad netanyahu united musuh pbnu ayam geprek image samsung yati gbla bubur ayam lasem miku éžæµ,Negatif,KOTA BANDUNG
ketua mendukung penuh perpres nomer tante lien onad netanyahu united musuh pbnu ayam geprek image samsung yati gbla bubur ayam lasem miku éžæµ,Negatif, TUBAN
menteri pupr fasilitas minum masuk kota nusantara tante lien onad netanyahu united musuh pbnu ayam geprek image samsung yati gbla bubur ayam lasem miku éžæµ,Negatif, MADIUN
ketua pbnu yahya cholil staquf organisasi pusat studi warisan ibrahim perdamaian rahim takedown website mencatut logo izin,Negatif, NGANJUK
pbnu ormas islam sunni halnya organisasi indonesia mayoritas mahzab syafii islam sunni membenci mengecam zionis israel disatu sisi israel standar ganda didalam kemunafikan pengkhianat terhad,Negatif, KUDUS
kecam nahdliyin temui presiden israel pbnu tertibkan anggota,Netral,KOTA MALANG
pulangkah orang penghianat,Negatif, NAGAN RAYA
progres pembangunan bandara vvip ibukota nusantara mencapai tante lien onad netanyahu united musuh pbnu yati gbla bubur ayam lasem yahudi,Negatif, LAHAT
ketawanya penderitaannya pbnu wkwkwk netanyahu united,Negatif, SUKOHARJO
ditolak pbnu,Positif, PROBOLINGGO
surabaya jepang full video qris musuh kokas ultramilk suzy rasis anies baswedan nova pbnu qodari,Negatif, SERDANG BEDAGAI
bubarkan pbnu anjing anjing peci hitam ketum pbnu nahdliyin kerjasama zionis israelpbnu ormas islam sunni mengecam israel kerjasa israel sunni munafik mahzab islam sunni pengkhianat islam,Negatif, SUMBA BARAT
alesannya macem geopolitik umur nama pribadi izin pbnu bawa nama cebokin udah paham udah keropos didalam disusupi model orang,Negatif, SERANG
pemecatan langkah semestinya pbnu menjaga marwah organisasi amanah pendirinya yahya rekam jejak,Negatif, KENDAL
buntut kunjungan nahdiyin israel ketegasan pbnu marwah amanah pbnu menyesalkan kunjungan nahdiyin menemui presiden israel ketumnya yahya tsaquf ambil tindakan,Negatif, MUSI RAWAS UTARA
just pbnu memelesetkan logo perbuatan etis click also,Negatif, DHARMASRAYA
just pbnu sponsori pertemuan warga presiden israel click also,Negatif, SUMEDANG
keikut sertaan bank central asia groundbreaking tante lien onad netanyahu united musuh pbnu ayam geprek image samsung yati gbla bubur ayam lasem miku éžæµ,Negatif,KOTA PEKALONGAN
sepakat baiknya temen temen defensif denial pake teori konspirasi mending dipake neken pengurus pbnu momentum gini emang momentum bersih bersih mempertahanin duri duri menguntungkan pbnu kecuali,Negatif,KOTA PANGKAL PINANG
pengurus nahdatul ulama pbnu klarifikasi terkait pemuda warga menemui presiden israel isaac herzog pengurus nahdatul ulama pertemuan nama organisasi inisiatif pribadi,Netral, ACEH SINGKIL
ketua pbnu permohonan maaf menyesalkan kejadian dereng cekap nggih,Negatif, LABUHAN BATU
sejarah berulang ketua pbnu pbnu yahya israel anak muda mencontoh seniornya,Negatif, BANGKA BARAT
pernyataan resmi pbnu tokoh nahdliyin temui presiden israel,Negatif,KOTA BENGKULU
ketum pbnu maaf terkait pertemuan tokoh muda presiden israel,Netral, INDRAGIRI HULU
upacara digelar iknðÿ tante lien onad netanyahu united musuh pbnu ayam geprek image samsung yati gbla bubur ayam,Negatif, PURBALINGGA
ketum pbnu yahya cholil staquf yahya mengklarifikasi pencabutan logo lembaga organisasi pusat studi warisan ibrahim perdamaian rahim cari informasinya,Negatif,KOTA BANJAR
pbnu skrg rusak,Negatif,KOTA CIMAHI
rusak pimpinan pbnu memalukan,Negatif, PIDIE
bgmn ketum pbnu sdhlah skrg kerusakan parah disebabkan oknum disayangkan oknumnya uaaaakehhhhh,Negatif, WAY KANAN
bubarkan pbnu islam sunni malu umat islam indonesia mata dunia islam sunni bisanya mengecam standar ganda tlah terlibat kerja zionis israel penjajah palestina beda islam sunnidi arabkalian,Negatif, KEBUMEN
pengurus nahdlatul ulama pbnu didesak pembinaan kadernya bertemu presiden israel isaac herzog pbnu terlibat pemberangkatan pertemuan,Netral,KOTA PAYAKUMBUH
pbnu negor akun marah benci coba tertibin akun gini,Negatif, OGAN KOMERING ULU TIMUR
narasi umur kemarin berseliweran timeline dijadikan berita bumerang pertanyaannya umur jabatan banom pbnu dosen perguruan,Negatif, TEGAL
nyasbg penyesalanketua pbnu nelpon presiden isrewel presidentthey mature enough talk bout this,Positif, BANDUNG BARAT
sepengetahuan pbnu,Positif, PROBOLINGGO
musuh ketua pbnu mblo,Netral, BANGKA SELATAN
oknum oknum pengurus pbnu skrang menjijikan,Positif, SLEMAN
umur ketemu netanyahu langsung ketua pbnu,Negatif,KOTA SUBULUSSALAM
biangnya ketua pbnu,Positif,KOTA TANGERANG
menlu sudi denger dubes israel pidato sidang sikap indonesia sesuai amanat pembukaan menentang bentuk penjajahan dunia kera kera mengaku cendikiawan senyum foto bareng,Negatif, ROKAN HILIR
terancam sanksi pbnu jokowi respons nahdliyin bertemu presiden israel,Netral, PANDEGLANG
nahdliyin bertemu presiden israel mengikuti ketum pbnu yahya cholil staquf bertemu netanyahu islam sunni bisanya ngecam dibalik membangun kerjasa zionis israel munafik beda saudaranya islam syiah,Negatif, LIMA PULUH KOTA
menlu sudi denger dubes israel pidato sidang sikap indonesia sesuai amanat pembukaan menentang bentuk penjajahan dunia kera kera mengaku cendikiawan senyum foto bareng dedengkotnya zionist israel pbnu,Negatif, KEPAHIANG
ancur marwah,Positif, TANGGAMUS
lupa pbnu yahya staquf ketemu netanyahu,Netral, SOLOK SELATAN
viral ngaku pribadi pengurus pbnu skrng mencla mencle kekuasaan cuan,Negatif,KOTA B A T A M
penasaran kali elite berkunjung ngeselin seandainya kepergian orang sorotan publik viral pbnu sanksi,Negatif,KOTA BANDA ACEH
